Ness amiibo for $35 w/ free shipping gogogo!,http://www.amazon.ca/gp/aw/d/B00TS0UK0I/ref=mp_s_a_1_2?qid=1433252555&sr=8-2&pi=SY200_QL40&keywords=ness+amiibo&dpPl=1&dpID=41ir4pn55nL&ref=plSrch
Greninja Available,http://www.toysrus.ca/product/index.jsp?prodFindSrc=cart&productId=62616606
Thoughts on Chibi Robo amiibo,/r/AmiiboCanada/comments/3876lh/thoughts_on_chibi_robo_amiibo/
"JPN/EU/AUS to reprint Lucina/Robin again, along with other unicorns",/r/AmiiboCanada/comments/3873u9/jpneuaus_to_reprint_lucinarobin_again_along_with/
What's the best way to remove a price sticker from an amiibo box again?,/r/AmiiboCanada/comments/38709r/whats_the_best_way_to_remove_a_price_sticker_from/
I have collected hockey cards hardcore in the past. I am not a particular fan of Animal Crossing.....why do I want the amiibo cards so damn much?,/r/AmiiboCanada/comments/386p6k/i_have_collected_hockey_cards_hardcore_in_the/
"I've finally recovered from Friday's #Amiibogeddon. amiibo hunting is no joke, y'all 💀",http://imgur.com/zIfA1ti
Meme Knight + Lizardon arrived in perfect condition,http://imgur.com/2Z0H98h
Change shipping address for one amiibo in amazon.de order?,/r/AmiiboCanada/comments/386e3y/change_shipping_address_for_one_amiibo_in/
How much does NA Pitt worth?,/r/AmiiboCanada/comments/386cdk/how_much_does_na_pitt_worth/
Any Video Game Repair stores in Vancouver?,/r/AmiiboCanada/comments/3868td/any_video_game_repair_stores_in_vancouver/
Proof,/r/AmiiboCanada/comments/38643l/proof/
Has anyone seen Jiggs in Toronto?,/r/AmiiboCanada/comments/3862zn/has_anyone_seen_jiggs_in_toronto/
"Jigglypuff Girl, May 29th",/r/AmiiboCanada/comments/385ymg/jigglypuff_girl_may_29th/
Someone just offered me drugs for my Amiibo...,/r/AmiiboCanada/comments/385vhf/someone_just_offered_me_drugs_for_my_amiibo/
Pac-Man Approves!,http://imgur.com/eN67l0y
Custom Yoshi Amiibo,http://i.imgur.com/X8UATZa.jpg?1
Felt good on 29th...,/r/AmiiboCanada/comments/385rki/felt_good_on_29th/
Does anyone know where someone can find the splatoon 3 pack in Ontario anymore?,/r/AmiiboCanada/comments/385q79/does_anyone_know_where_someone_can_find_the/
Just another scumbag scalper.,http://nanaimo.craigslist.ca/vgm/5053715570.html
"If you're amiibo tracking from Walmart says ""Levis, QC""...",/r/AmiiboCanada/comments/385la7/if_youre_amiibo_tracking_from_walmart_says_levis/
"Silver mine with gems of pink in Peace River, AB",http://imgur.com/AmoguSi
Post wave 4 release collection. Thanks AmiiboCanada!,http://imgur.com/xy87f7m
"Where can I find a good, low-priced display to fit ALL smash amiibo?",/r/AmiiboCanada/comments/385g7n/where_can_i_find_a_good_lowpriced_display_to_fit/
Charizard (and Pac-Man) up on The Source!,http://www.thesource.ca/estore/product.aspx?language=en-CA&catalog=Online&category=wii-u-accessories&product=8035484
